id,title,abstract,img,slug,content,views,is_publish,update_time,type_id,is_hot,pub_date
1,城市公共信息服务平台,"<p style=""cursor: default; color: rgb(102, 102, 102);",pictures/case/2018/05/15/parallax_main.jpg,case_1,"<p style=""cursor: default; color: rgb(102, 102, 102); font-family: &quot;Open Sans&quot;, Arial, &quot;Hiragino Sans GB&quot;, &quot;Microsoft YaHei&quot;, 微软雅黑, STHeiti, &quot;WenQuanYi Micro Hei&quot;, SimSun, sans-serif; font-size: 16px; font-style: normal; font-variant-ligatures: normal; font-variant-caps: normal; font-weight: normal; letter-spacing: normal; orphans: 2; text-align: start; text-indent: 0px; text-transform: none; white-space: normal; widows: 2; word-spacing: 0px; -webkit-text-stroke-width: 0px; background-color: rgb(255, 255, 255); text-decoration-style: initial; text-decoration-color: initial;"">根据《力软敏捷开发框架》 来进行改造，充分利用云计算、大数据等新一代信息技术进行融合创新， 为市民、企业和城市管理者提供了通畅的双向、多向信息沟通机制和便捷的服务渠道。</p><p style=""cursor: default; color: rgb(102, 102, 102); font-family: &quot;Open Sans&quot;, Arial, &quot;Hiragino Sans GB&quot;, &quot;Microsoft YaHei&quot;, 微软雅黑, STHeiti, &quot;WenQuanYi Micro Hei&quot;, SimSun, sans-serif; font-size: 16px; font-style: normal; font-variant-ligatures: normal; font-variant-caps: normal; font-weight: normal; letter-spacing: normal; orphans: 2; text-align: start; text-indent: 0px; text-transform: none; white-space: normal; widows: 2; word-spacing: 0px; -webkit-text-stroke-width: 0px; background-color: rgb(255, 255, 255); text-decoration-style: initial; text-decoration-color: initial;"">此平台由市民融合服务平台、企业融合服务平台和城市管理服务平台三部分构成：<br/>面向市民，以改善、保障和服务民生为出发点；<br/>面向企业，以持续促进经济转型发展、创造优良产业环境、拉动企业创新为目的；<span class=""Apple-converted-space"">&nbsp;</span><br/><span class=""Apple-converted-space"">&nbsp;</span>面向城市管理者，一方面要围绕环境、交通、医疗、教育等，构建智慧城市日常运营以及应急联动指挥响应管理平台， 另一方面，构建科学决策系统，通过对城市复杂系统进行大数据挖掘，寻找城市科学的发展规律，验证政策的合理与有效性，从而推动科学决策，为可持续发展目标提供决策工具。</p><p style=""cursor: default; color: rgb(102, 102, 102);"">－部分界面</p><p><img src=""http://www.learun.cn/Content/images/demo7.png"" alt=""力软信息,快速开发平台,快速开发框架"" style=""margin: 0px; padding: 0px; text-decoration: none; list-style: none; border: 1px solid rgb(238, 238, 238);""/></p><p style=""line-height: 16px;""><img style=""vertical-align: middle; margin-right: 2px;"" src=""http://127.0.0.1:8000/static/ueditor/dialogs/attachment/fileTypeImages/icon_rar.gif""/><a style=""font-size:12px; color:#0066cc;"" href=""/media/uploads/files/很棒的css3 Tab_20180515175713_739.zip"" title=""很棒的css3 Tab.zip"">很棒的css3 Tab.zip</a></p><p><iframe class=""ueditor_baidumap"" src=""http://127.0.0.1:8000/static/ueditor/dialogs/map/show.html#center=114.311586,30.598467&zoom=13&width=530&height=340&markers=114.311586,30.598467&markerStyles=l,A"" width=""534"" height=""344"" frameborder=""0""></iframe><br/></p><p><br/></p>",6,1,2018-05-17 09:59:56.434168,1,1,2018-05-15 17:42:56.174861
4,标题一,学生务必在每项内容填写,pictures/case/2018/05/16/QQ截图20180514132743_fXRcWFf.png,21324,"<p>网上申请论文答辩填写说明：</p><p style=""text-align:left;"">1、登录研究生管理信息系统，进入“学位”模块，点击左侧菜单栏中“学位论文评审管理”按钮进行学位论文答辩申请；</p><p style=""text-align:left;"">2、填写申请学位论文答辩申请信息后，点击右上角“保存”键保存（关键词3-5个，用“，”号隔开）；</p><p style=""text-align:left;"">3、点击右端修改标志，继续填写申请学位论文答辩的详细内容；学生务必在每项内容填写完成后都及时点击页面右上角的“保存”标志，否则所填内容系统不会记忆。（重要，请切记）；</p><p style=""text-align:left;"">4、系统自动抓取阶段报告题目，阶段报告后不允许调整论文题目；</p><p>5、在“论文、成果”一栏根据《研究生在读期间公开发表学术论文要求的规定》选择申请答辩所需数量的论文、科研成果或专利。注意：论文或获奖成果的扫描件未上传无法成为答辩申请材料；未发表不能成为答辩申请材料；论文篇数不超过5篇，超过将导致文件格式紊乱。（专业硕士无需此项）</p><p>6、“评审信息”中的“秘书”与“评阅人”信息暂时不需填写。</p><p>7、学生本人在“审核材料”一栏下载导出审批材料一，仔细检查信息是否完整，如有空白，需在系统完善相关信息（主要检查位置：封面研究方向、申请人基本信息完整、论文对应章节、最后一页为双面打印）；确定论文答辩申请材料填写完毕且不再改修后，务必将“基本信息”项中“提交状态”一栏变更为“已完成”，否则，导师将无法浏览和审核学生的申请材料。</p><p>8、学生看到“导师审核”栏内容变更为“是”后，在“审核材料”页面下载导出完整</p><p><br/></p>",1,1,2018-05-17 17:36:25.950759,1,0,2018-05-16 17:10:17.250302
5,公司网站标题一,,pictures/case/2018/05/16/QQ截图20180514132821_h1qa4uD.png,gegett87,"<p style=""box-sizing: border-box; outline: 0px; padding: 0px; margin: 0px 0px 16px; font-size: 16px; color: rgb(79, 79, 79); font-weight: normal; line-height: 26px; text-align: justify; word-break: break-all; font-family: -apple-system, &quot;SF UI Text&quot;, Arial, &quot;PingFang SC&quot;, &quot;Hiragino Sans GB&quot;, &quot;Microsoft YaHei&quot;, &quot;WenQuanYi Micro Hei&quot;, sans-serif, SimHei, SimSun; font-style: normal; font-variant-ligatures: normal; font-variant-caps: normal; letter-spacing: normal; orphans: 2; text-indent: 0px; text-transform: none; white-space: normal; widows: 2; word-spacing: 0px; -webkit-text-stroke-width: 0px; background-color: rgb(255, 255, 255); text-decoration-style: initial; text-decoration-color: initial;"">xadmin为django后台管理系统admin的升级版，<a href=""https://github.com/sshwsfc/xadmin"" target=""_blank"" style=""box-sizing: border-box; outline: 0px; color: rgb(103, 149, 181); text-decoration: none; cursor: pointer; word-break: break-all;"">点击进入github</a></p><p style=""box-sizing: border-box; outline: 0px; padding: 0px; margin: 0px 0px 16px; font-size: 16px; color: rgb(79, 79, 79); font-weight: normal; line-height: 26px; text-align: justify; word-break: break-all; font-family: -apple-system, &quot;SF UI Text&quot;, Arial, &quot;PingFang SC&quot;, &quot;Hiragino Sans GB&quot;, &quot;Microsoft YaHei&quot;, &quot;WenQuanYi Micro Hei&quot;, sans-serif, SimHei, SimSun; font-style: normal; font-variant-ligatures: normal; font-variant-caps: normal; letter-spacing: normal; orphans: 2; text-indent: 0px; text-transform: none; white-space: normal; widows: 2; word-spacing: 0px; -webkit-text-stroke-width: 0px; background-color: rgb(255, 255, 255); text-decoration-style: initial; text-decoration-color: initial;"">在对后台进行编辑时，采用百度开源的富文本编辑器ueditor，本文采用djangoueditor，<a href=""https://github.com/zhangfisher/DjangoUeditor"" target=""_blank"" style=""box-sizing: border-box; outline: 0px; color: rgb(103, 149, 181); text-decoration: none; cursor: pointer; word-break: break-all;"">源程序点此进入</a>。由于作者不再对其进行维护，这个版本不再适用于Python3版本，Python3的版本安装<span class=""Apple-converted-space"">&nbsp;</span><a href=""https://github.com/twz915/DjangoUeditor3"" target=""_blank"" style=""box-sizing: border-box; outline: 0px; color: rgb(103, 149, 181); text-decoration: none; cursor: pointer; word-break: break-all;"">点此进入</a>。</p><p style=""box-sizing: border-box; outline: 0px; padding: 0px; margin: 0px 0px 16px; font-size: 16px; color: rgb(79, 79, 79); font-weight: normal; line-height: 26px; text-align: justify; word-break: break-all; font-family: -apple-system, &quot;SF UI Text&quot;, Arial, &quot;PingFang SC&quot;, &quot;Hiragino Sans GB&quot;, &quot;Microsoft YaHei&quot;, &quot;WenQuanYi Micro Hei&quot;, sans-serif, SimHei, SimSun; font-style: normal; font-variant-ligatures: normal; font-variant-caps: normal; letter-spacing: normal; orphans: 2; text-indent: 0px; text-transform: none; white-space: normal; widows: 2; word-spacing: 0px; -webkit-text-stroke-width: 0px; background-color: rgb(255, 255, 255); text-decoration-style: initial; text-decoration-color: initial;"">对于以上xadmin和djangoueditor 的安装，本人建议直接集成在pycharm中，而不是装在虚拟环境中。因为xadmin中如果需要集成插件的话，需要对其进行添加；而djangoueditor采用pip安装的话，只能用在Python2版本中。</p><p style=""box-sizing: border-box; outline: 0px; padding: 0px; margin: 0px 0px 16px; font-size: 16px; color: rgb(79, 79, 79); font-weight: normal; line-height: 26px; text-align: justify; word-break: break-all; font-family: -apple-system, &quot;SF UI Text&quot;, Arial, &quot;PingFang SC&quot;, &quot;Hiragino Sans GB&quot;, &quot;Microsoft YaHei&quot;, &quot;WenQuanYi Micro Hei&quot;, sans-serif, SimHei, SimSun; font-style: normal; font-variant-ligatures: normal; font-variant-caps: normal; letter-spacing: normal; orphans: 2; text-indent: 0px; text-transform: none; white-space: normal; widows: 2; word-spacing: 0px; -webkit-text-stroke-width: 0px; background-color: rgb(255, 255, 255); text-decoration-style: initial; text-decoration-color: initial;"">因此建议将源码包下载下来，并直接放在项目下的extra_apps中，如下所示：</p><p style=""box-sizing: border-box; outline: 0px; padding: 0px; margin: 0px 0px 16px; font-size: 16px; color: rgb(79, 79, 79); font-weight: normal; line-height: 26px; text-align: justify; word-break: break-all; font-family: -apple-system, &quot;SF UI Text&quot;, Arial, &quot;PingFang SC&quot;, &quot;Hiragino Sans GB&quot;, &quot;Microsoft YaHei&quot;, &quot;WenQuanYi Micro Hei&quot;, sans-serif, SimHei, SimSun; font-style: normal; font-variant-ligatures: normal; font-variant-caps: normal; letter-spacing: normal; orphans: 2; text-indent: 0px; text-transform: none; white-space: normal; widows: 2; word-spacing: 0px; -webkit-text-stroke-width: 0px; background-color: rgb(255, 255, 255); text-decoration-style: initial; text-decoration-color: initial;""><img src=""https://img-blog.csdn.net/20180120151950476?watermark/2/text/aHR0cDovL2Jsb2cuY3Nkbi5uZXQvZ2Vlcm5peWE=/font/5a6L5L2T/fontsize/400/fill/I0JBQkFCMA==/dissolve/70/gravity/SouthEast"" alt=""这里写图片描述"" title="""" style=""box-sizing: border-box; outline: 0px; margin: 24px 0px; max-width: 100%; word-break: break-all; cursor: zoom-in;""/></p><p><br/></p>",21,1,2018-05-17 17:57:16.244271,2,1,2018-05-16 17:30:30.384423
