id,title,abstract,img,slug,content,views,is_publish,update_time,type_id,is_hot,pub_date
93,标题9,学生务必在每项内容填写摘要9,pictures/case/2018/05/16/QQ截图20180514132743_fXRcWFf.png,121gtt4374,"<p style=""box-sizing: border-box; outline: 0px; padding: 0px; margin: 0px 0px 16px; font-size: 16px; color: rgb(79, 79, 79); font-weight: normal; line-height: 26px; text-align: justify; word-break: break-all; font-family: -apple-system, &quot;SF UI Text&quot;, Arial, &quot;PingFang SC&quot;, &quot;Hiragino Sans GB&quot;, &quot;Microsoft YaHei&quot;, &quot;WenQuanYi Micro Hei&quot;, sans-serif, SimHei, SimSun; font-style: normal; font-variant-ligatures: normal; font-variant-caps: normal; letter-spacing: normal; orphans: 2; text-indent: 0px; text-transform: none; white-space: normal; widows: 2; word-spacing: 0px; -webkit-text-stroke-width: 0px; background-color: rgb(255, 255, 255); text-decoration-style: initial; text-decoration-color: initial;"">xadmin为django后台管理系统admin的升级版，<a href=""https://github.com/sshwsfc/xadmin"" target=""_blank"" style=""box-sizing: border-box; outline: 0px; color: rgb(103, 149, 181); text-decoration: none; cursor: pointer; word-break: break-all;"">点击进入github</a></p><p style=""box-sizing: border-box; outline: 0px; padding: 0px; margin: 0px 0px 16px; font-size: 16px; color: rgb(79, 79, 79); font-weight: normal; line-height: 26px; text-align: justify; word-break: break-all; font-family: -apple-system, &quot;SF UI Text&quot;, Arial, &quot;PingFang SC&quot;, &quot;Hiragino Sans GB&quot;, &quot;Microsoft YaHei&quot;, &quot;WenQuanYi Micro Hei&quot;, sans-serif, SimHei, SimSun; font-style: normal; font-variant-ligatures: normal; font-variant-caps: normal; letter-spacing: normal; orphans: 2; text-indent: 0px; text-transform: none; white-space: normal; widows: 2; word-spacing: 0px; -webkit-text-stroke-width: 0px; background-color: rgb(255, 255, 255); text-decoration-style: initial; text-decoration-color: initial;"">在对后台进行编辑时，采用百度开源的富文本编辑器ueditor，本文采用djangoueditor，<a href=""https://github.com/zhangfisher/DjangoUeditor"" target=""_blank"" style=""box-sizing: border-box; outline: 0px; color: rgb(103, 149, 181); text-decoration: none; cursor: pointer; word-break: break-all;"">源程序点此进入</a>。由于作者不再对其进行维护，这个版本不再适用于Python3版本，Python3的版本安装<span class=""Apple-converted-space"">&nbsp;</span><a href=""https://github.com/twz915/DjangoUeditor3"" target=""_blank"" style=""box-sizing: border-box; outline: 0px; color: rgb(103, 149, 181); text-decoration: none; cursor: pointer; word-break: break-all;"">点此进入</a>。</p><p style=""box-sizing: border-box; outline: 0px; padding: 0px; margin: 0px 0px 16px; font-size: 16px; color: rgb(79, 79, 79); font-weight: normal; line-height: 26px; text-align: justify; word-break: break-all; font-family: -apple-system, &quot;SF UI Text&quot;, Arial, &quot;PingFang SC&quot;, &quot;Hiragino Sans GB&quot;, &quot;Microsoft YaHei&quot;, &quot;WenQuanYi Micro Hei&quot;, sans-serif, SimHei, SimSun; font-style: normal; font-variant-ligatures: normal; font-variant-caps: normal; letter-spacing: normal; orphans: 2; text-indent: 0px; text-transform: none; white-space: normal; widows: 2; word-spacing: 0px; -webkit-text-stroke-width: 0px; background-color: rgb(255, 255, 255); text-decoration-style: initial; text-decoration-color: initial;"">对于以上xadmin和djangoueditor 的安装，本人建议直接集成在pycharm中，而不是装在虚拟环境中。因为xadmin中如果需要集成插件的话，需要对其进行添加；而djangoueditor采用pip安装的话，只能用在Python2版本中。</p><p style=""box-sizing: border-box; outline: 0px; padding: 0px; margin: 0px 0px 16px; font-size: 16px; color: rgb(79, 79, 79); font-weight: normal; line-height: 26px; text-align: justify; word-break: break-all; font-family: -apple-system, &quot;SF UI Text&quot;, Arial, &quot;PingFang SC&quot;, &quot;Hiragino Sans GB&quot;, &quot;Microsoft YaHei&quot;, &quot;WenQuanYi Micro Hei&quot;, sans-serif, SimHei, SimSun; font-style: normal; font-variant-ligatures: normal; font-variant-caps: normal; letter-spacing: normal; orphans: 2; text-indent: 0px; text-transform: none; white-space: normal; widows: 2; word-spacing: 0px; -webkit-text-stroke-width: 0px; background-color: rgb(255, 255, 255); text-decoration-style: initial; text-decoration-color: initial;"">因此建议将源码包下载下来，并直接放在项目下的extra_apps中，如下所示：</p><p style=""box-sizing: border-box; outline: 0px; padding: 0px; margin: 0px 0px 16px; font-size: 16px; color: rgb(79, 79, 79); font-weight: normal; line-height: 26px; text-align: justify; word-break: break-all; font-family: -apple-system, &quot;SF UI Text&quot;, Arial, &quot;PingFang SC&quot;, &quot;Hiragino Sans GB&quot;, &quot;Microsoft YaHei&quot;, &quot;WenQuanYi Micro Hei&quot;, sans-serif, SimHei, SimSun; font-style: normal; font-variant-ligatures: normal; font-variant-caps: normal; letter-spacing: normal; orphans: 2; text-indent: 0px; text-transform: none; white-space: normal; widows: 2; word-spacing: 0px; -webkit-text-stroke-width: 0px; background-color: rgb(255, 255, 255); text-decoration-style: initial; text-decoration-color: initial;""><img src=""https://img-blog.csdn.net/20180120151950476?watermark/2/text/aHR0cDovL2Jsb2cuY3Nkbi5uZXQvZ2Vlcm5peWE=/font/5a6L5L2T/fontsize/400/fill/I0JBQkFCMA==/dissolve/70/gravity/SouthEast"" alt=""这里写图片描述"" title="""" style=""box-sizing: border-box; outline: 0px; margin: 24px 0px; max-width: 100%; word-break: break-all; cursor: zoom-in;""/></p><p><br/></p>",0,1,2018-05-22 11:37:24.899556,1,0,2018-05-22 11:37:24.898556
94,标题10,学生务必在每项内容填写摘要10,pictures/case/2018/05/16/QQ截图20180514132821_h1qa4uD.png,121gtt4375,"<p style=""box-sizing: border-box; outline: 0px; padding: 0px; margin: 0px 0px 16px; font-size: 16px; color: rgb(79, 79, 79); font-weight: normal; line-height: 26px; text-align: justify; word-break: break-all; font-family: -apple-system, &quot;SF UI Text&quot;, Arial, &quot;PingFang SC&quot;, &quot;Hiragino Sans GB&quot;, &quot;Microsoft YaHei&quot;, &quot;WenQuanYi Micro Hei&quot;, sans-serif, SimHei, SimSun; font-style: normal; font-variant-ligatures: normal; font-variant-caps: normal; letter-spacing: normal; orphans: 2; text-indent: 0px; text-transform: none; white-space: normal; widows: 2; word-spacing: 0px; -webkit-text-stroke-width: 0px; background-color: rgb(255, 255, 255); text-decoration-style: initial; text-decoration-color: initial;"">xadmin为django后台管理系统admin的升级版，<a href=""https://github.com/sshwsfc/xadmin"" target=""_blank"" style=""box-sizing: border-box; outline: 0px; color: rgb(103, 149, 181); text-decoration: none; cursor: pointer; word-break: break-all;"">点击进入github</a></p><p style=""box-sizing: border-box; outline: 0px; padding: 0px; margin: 0px 0px 16px; font-size: 16px; color: rgb(79, 79, 79); font-weight: normal; line-height: 26px; text-align: justify; word-break: break-all; font-family: -apple-system, &quot;SF UI Text&quot;, Arial, &quot;PingFang SC&quot;, &quot;Hiragino Sans GB&quot;, &quot;Microsoft YaHei&quot;, &quot;WenQuanYi Micro Hei&quot;, sans-serif, SimHei, SimSun; font-style: normal; font-variant-ligatures: normal; font-variant-caps: normal; letter-spacing: normal; orphans: 2; text-indent: 0px; text-transform: none; white-space: normal; widows: 2; word-spacing: 0px; -webkit-text-stroke-width: 0px; background-color: rgb(255, 255, 255); text-decoration-style: initial; text-decoration-color: initial;"">在对后台进行编辑时，采用百度开源的富文本编辑器ueditor，本文采用djangoueditor，<a href=""https://github.com/zhangfisher/DjangoUeditor"" target=""_blank"" style=""box-sizing: border-box; outline: 0px; color: rgb(103, 149, 181); text-decoration: none; cursor: pointer; word-break: break-all;"">源程序点此进入</a>。由于作者不再对其进行维护，这个版本不再适用于Python3版本，Python3的版本安装<span class=""Apple-converted-space"">&nbsp;</span><a href=""https://github.com/twz915/DjangoUeditor3"" target=""_blank"" style=""box-sizing: border-box; outline: 0px; color: rgb(103, 149, 181); text-decoration: none; cursor: pointer; word-break: break-all;"">点此进入</a>。</p><p style=""box-sizing: border-box; outline: 0px; padding: 0px; margin: 0px 0px 16px; font-size: 16px; color: rgb(79, 79, 79); font-weight: normal; line-height: 26px; text-align: justify; word-break: break-all; font-family: -apple-system, &quot;SF UI Text&quot;, Arial, &quot;PingFang SC&quot;, &quot;Hiragino Sans GB&quot;, &quot;Microsoft YaHei&quot;, &quot;WenQuanYi Micro Hei&quot;, sans-serif, SimHei, SimSun; font-style: normal; font-variant-ligatures: normal; font-variant-caps: normal; letter-spacing: normal; orphans: 2; text-indent: 0px; text-transform: none; white-space: normal; widows: 2; word-spacing: 0px; -webkit-text-stroke-width: 0px; background-color: rgb(255, 255, 255); text-decoration-style: initial; text-decoration-color: initial;"">对于以上xadmin和djangoueditor 的安装，本人建议直接集成在pycharm中，而不是装在虚拟环境中。因为xadmin中如果需要集成插件的话，需要对其进行添加；而djangoueditor采用pip安装的话，只能用在Python2版本中。</p><p style=""box-sizing: border-box; outline: 0px; padding: 0px; margin: 0px 0px 16px; font-size: 16px; color: rgb(79, 79, 79); font-weight: normal; line-height: 26px; text-align: justify; word-break: break-all; font-family: -apple-system, &quot;SF UI Text&quot;, Arial, &quot;PingFang SC&quot;, &quot;Hiragino Sans GB&quot;, &quot;Microsoft YaHei&quot;, &quot;WenQuanYi Micro Hei&quot;, sans-serif, SimHei, SimSun; font-style: normal; font-variant-ligatures: normal; font-variant-caps: normal; letter-spacing: normal; orphans: 2; text-indent: 0px; text-transform: none; white-space: normal; widows: 2; word-spacing: 0px; -webkit-text-stroke-width: 0px; background-color: rgb(255, 255, 255); text-decoration-style: initial; text-decoration-color: initial;"">因此建议将源码包下载下来，并直接放在项目下的extra_apps中，如下所示：</p><p style=""box-sizing: border-box; outline: 0px; padding: 0px; margin: 0px 0px 16px; font-size: 16px; color: rgb(79, 79, 79); font-weight: normal; line-height: 26px; text-align: justify; word-break: break-all; font-family: -apple-system, &quot;SF UI Text&quot;, Arial, &quot;PingFang SC&quot;, &quot;Hiragino Sans GB&quot;, &quot;Microsoft YaHei&quot;, &quot;WenQuanYi Micro Hei&quot;, sans-serif, SimHei, SimSun; font-style: normal; font-variant-ligatures: normal; font-variant-caps: normal; letter-spacing: normal; orphans: 2; text-indent: 0px; text-transform: none; white-space: normal; widows: 2; word-spacing: 0px; -webkit-text-stroke-width: 0px; background-color: rgb(255, 255, 255); text-decoration-style: initial; text-decoration-color: initial;""><img src=""https://img-blog.csdn.net/20180120151950476?watermark/2/text/aHR0cDovL2Jsb2cuY3Nkbi5uZXQvZ2Vlcm5peWE=/font/5a6L5L2T/fontsize/400/fill/I0JBQkFCMA==/dissolve/70/gravity/SouthEast"" alt=""这里写图片描述"" title="""" style=""box-sizing: border-box; outline: 0px; margin: 24px 0px; max-width: 100%; word-break: break-all; cursor: zoom-in;""/></p><p><br/></p>",0,1,2018-05-22 11:37:24.901556,3,0,2018-05-22 11:37:24.900556
95,标题11,学生务必在每项内容填写摘要11,pictures/case/2018/05/16/QQ截图20180514132743_fXRcWFf.png,121gtt4376,"<p style=""box-sizing: border-box; outline: 0px; padding: 0px; margin: 0px 0px 16px; font-size: 16px; color: rgb(79, 79, 79); font-weight: normal; line-height: 26px; text-align: justify; word-break: break-all; font-family: -apple-system, &quot;SF UI Text&quot;, Arial, &quot;PingFang SC&quot;, &quot;Hiragino Sans GB&quot;, &quot;Microsoft YaHei&quot;, &quot;WenQuanYi Micro Hei&quot;, sans-serif, SimHei, SimSun; font-style: normal; font-variant-ligatures: normal; font-variant-caps: normal; letter-spacing: normal; orphans: 2; text-indent: 0px; text-transform: none; white-space: normal; widows: 2; word-spacing: 0px; -webkit-text-stroke-width: 0px; background-color: rgb(255, 255, 255); text-decoration-style: initial; text-decoration-color: initial;"">xadmin为django后台管理系统admin的升级版，<a href=""https://github.com/sshwsfc/xadmin"" target=""_blank"" style=""box-sizing: border-box; outline: 0px; color: rgb(103, 149, 181); text-decoration: none; cursor: pointer; word-break: break-all;"">点击进入github</a></p><p style=""box-sizing: border-box; outline: 0px; padding: 0px; margin: 0px 0px 16px; font-size: 16px; color: rgb(79, 79, 79); font-weight: normal; line-height: 26px; text-align: justify; word-break: break-all; font-family: -apple-system, &quot;SF UI Text&quot;, Arial, &quot;PingFang SC&quot;, &quot;Hiragino Sans GB&quot;, &quot;Microsoft YaHei&quot;, &quot;WenQuanYi Micro Hei&quot;, sans-serif, SimHei, SimSun; font-style: normal; font-variant-ligatures: normal; font-variant-caps: normal; letter-spacing: normal; orphans: 2; text-indent: 0px; text-transform: none; white-space: normal; widows: 2; word-spacing: 0px; -webkit-text-stroke-width: 0px; background-color: rgb(255, 255, 255); text-decoration-style: initial; text-decoration-color: initial;"">在对后台进行编辑时，采用百度开源的富文本编辑器ueditor，本文采用djangoueditor，<a href=""https://github.com/zhangfisher/DjangoUeditor"" target=""_blank"" style=""box-sizing: border-box; outline: 0px; color: rgb(103, 149, 181); text-decoration: none; cursor: pointer; word-break: break-all;"">源程序点此进入</a>。由于作者不再对其进行维护，这个版本不再适用于Python3版本，Python3的版本安装<span class=""Apple-converted-space"">&nbsp;</span><a href=""https://github.com/twz915/DjangoUeditor3"" target=""_blank"" style=""box-sizing: border-box; outline: 0px; color: rgb(103, 149, 181); text-decoration: none; cursor: pointer; word-break: break-all;"">点此进入</a>。</p><p style=""box-sizing: border-box; outline: 0px; padding: 0px; margin: 0px 0px 16px; font-size: 16px; color: rgb(79, 79, 79); font-weight: normal; line-height: 26px; text-align: justify; word-break: break-all; font-family: -apple-system, &quot;SF UI Text&quot;, Arial, &quot;PingFang SC&quot;, &quot;Hiragino Sans GB&quot;, &quot;Microsoft YaHei&quot;, &quot;WenQuanYi Micro Hei&quot;, sans-serif, SimHei, SimSun; font-style: normal; font-variant-ligatures: normal; font-variant-caps: normal; letter-spacing: normal; orphans: 2; text-indent: 0px; text-transform: none; white-space: normal; widows: 2; word-spacing: 0px; -webkit-text-stroke-width: 0px; background-color: rgb(255, 255, 255); text-decoration-style: initial; text-decoration-color: initial;"">对于以上xadmin和djangoueditor 的安装，本人建议直接集成在pycharm中，而不是装在虚拟环境中。因为xadmin中如果需要集成插件的话，需要对其进行添加；而djangoueditor采用pip安装的话，只能用在Python2版本中。</p><p style=""box-sizing: border-box; outline: 0px; padding: 0px; margin: 0px 0px 16px; font-size: 16px; color: rgb(79, 79, 79); font-weight: normal; line-height: 26px; text-align: justify; word-break: break-all; font-family: -apple-system, &quot;SF UI Text&quot;, Arial, &quot;PingFang SC&quot;, &quot;Hiragino Sans GB&quot;, &quot;Microsoft YaHei&quot;, &quot;WenQuanYi Micro Hei&quot;, sans-serif, SimHei, SimSun; font-style: normal; font-variant-ligatures: normal; font-variant-caps: normal; letter-spacing: normal; orphans: 2; text-indent: 0px; text-transform: none; white-space: normal; widows: 2; word-spacing: 0px; -webkit-text-stroke-width: 0px; background-color: rgb(255, 255, 255); text-decoration-style: initial; text-decoration-color: initial;"">因此建议将源码包下载下来，并直接放在项目下的extra_apps中，如下所示：</p><p style=""box-sizing: border-box; outline: 0px; padding: 0px; margin: 0px 0px 16px; font-size: 16px; color: rgb(79, 79, 79); font-weight: normal; line-height: 26px; text-align: justify; word-break: break-all; font-family: -apple-system, &quot;SF UI Text&quot;, Arial, &quot;PingFang SC&quot;, &quot;Hiragino Sans GB&quot;, &quot;Microsoft YaHei&quot;, &quot;WenQuanYi Micro Hei&quot;, sans-serif, SimHei, SimSun; font-style: normal; font-variant-ligatures: normal; font-variant-caps: normal; letter-spacing: normal; orphans: 2; text-indent: 0px; text-transform: none; white-space: normal; widows: 2; word-spacing: 0px; -webkit-text-stroke-width: 0px; background-color: rgb(255, 255, 255); text-decoration-style: initial; text-decoration-color: initial;""><img src=""https://img-blog.csdn.net/20180120151950476?watermark/2/text/aHR0cDovL2Jsb2cuY3Nkbi5uZXQvZ2Vlcm5peWE=/font/5a6L5L2T/fontsize/400/fill/I0JBQkFCMA==/dissolve/70/gravity/SouthEast"" alt=""这里写图片描述"" title="""" style=""box-sizing: border-box; outline: 0px; margin: 24px 0px; max-width: 100%; word-break: break-all; cursor: zoom-in;""/></p><p><br/></p>",0,1,2018-05-22 11:37:24.904557,4,0,2018-05-22 11:37:24.902557
96,标题12,学生务必在每项内容填写摘要12,pictures/case/2018/05/16/QQ截图20180514132821_h1qa4uD.png,121gtt4377,"<p style=""box-sizing: border-box; outline: 0px; padding: 0px; margin: 0px 0px 16px; font-size: 16px; color: rgb(79, 79, 79); font-weight: normal; line-height: 26px; text-align: justify; word-break: break-all; font-family: -apple-system, &quot;SF UI Text&quot;, Arial, &quot;PingFang SC&quot;, &quot;Hiragino Sans GB&quot;, &quot;Microsoft YaHei&quot;, &quot;WenQuanYi Micro Hei&quot;, sans-serif, SimHei, SimSun; font-style: normal; font-variant-ligatures: normal; font-variant-caps: normal; letter-spacing: normal; orphans: 2; text-indent: 0px; text-transform: none; white-space: normal; widows: 2; word-spacing: 0px; -webkit-text-stroke-width: 0px; background-color: rgb(255, 255, 255); text-decoration-style: initial; text-decoration-color: initial;"">xadmin为django后台管理系统admin的升级版，<a href=""https://github.com/sshwsfc/xadmin"" target=""_blank"" style=""box-sizing: border-box; outline: 0px; color: rgb(103, 149, 181); text-decoration: none; cursor: pointer; word-break: break-all;"">点击进入github</a></p><p style=""box-sizing: border-box; outline: 0px; padding: 0px; margin: 0px 0px 16px; font-size: 16px; color: rgb(79, 79, 79); font-weight: normal; line-height: 26px; text-align: justify; word-break: break-all; font-family: -apple-system, &quot;SF UI Text&quot;, Arial, &quot;PingFang SC&quot;, &quot;Hiragino Sans GB&quot;, &quot;Microsoft YaHei&quot;, &quot;WenQuanYi Micro Hei&quot;, sans-serif, SimHei, SimSun; font-style: normal; font-variant-ligatures: normal; font-variant-caps: normal; letter-spacing: normal; orphans: 2; text-indent: 0px; text-transform: none; white-space: normal; widows: 2; word-spacing: 0px; -webkit-text-stroke-width: 0px; background-color: rgb(255, 255, 255); text-decoration-style: initial; text-decoration-color: initial;"">在对后台进行编辑时，采用百度开源的富文本编辑器ueditor，本文采用djangoueditor，<a href=""https://github.com/zhangfisher/DjangoUeditor"" target=""_blank"" style=""box-sizing: border-box; outline: 0px; color: rgb(103, 149, 181); text-decoration: none; cursor: pointer; word-break: break-all;"">源程序点此进入</a>。由于作者不再对其进行维护，这个版本不再适用于Python3版本，Python3的版本安装<span class=""Apple-converted-space"">&nbsp;</span><a href=""https://github.com/twz915/DjangoUeditor3"" target=""_blank"" style=""box-sizing: border-box; outline: 0px; color: rgb(103, 149, 181); text-decoration: none; cursor: pointer; word-break: break-all;"">点此进入</a>。</p><p style=""box-sizing: border-box; outline: 0px; padding: 0px; margin: 0px 0px 16px; font-size: 16px; color: rgb(79, 79, 79); font-weight: normal; line-height: 26px; text-align: justify; word-break: break-all; font-family: -apple-system, &quot;SF UI Text&quot;, Arial, &quot;PingFang SC&quot;, &quot;Hiragino Sans GB&quot;, &quot;Microsoft YaHei&quot;, &quot;WenQuanYi Micro Hei&quot;, sans-serif, SimHei, SimSun; font-style: normal; font-variant-ligatures: normal; font-variant-caps: normal; letter-spacing: normal; orphans: 2; text-indent: 0px; text-transform: none; white-space: normal; widows: 2; word-spacing: 0px; -webkit-text-stroke-width: 0px; background-color: rgb(255, 255, 255); text-decoration-style: initial; text-decoration-color: initial;"">对于以上xadmin和djangoueditor 的安装，本人建议直接集成在pycharm中，而不是装在虚拟环境中。因为xadmin中如果需要集成插件的话，需要对其进行添加；而djangoueditor采用pip安装的话，只能用在Python2版本中。</p><p style=""box-sizing: border-box; outline: 0px; padding: 0px; margin: 0px 0px 16px; font-size: 16px; color: rgb(79, 79, 79); font-weight: normal; line-height: 26px; text-align: justify; word-break: break-all; font-family: -apple-system, &quot;SF UI Text&quot;, Arial, &quot;PingFang SC&quot;, &quot;Hiragino Sans GB&quot;, &quot;Microsoft YaHei&quot;, &quot;WenQuanYi Micro Hei&quot;, sans-serif, SimHei, SimSun; font-style: normal; font-variant-ligatures: normal; font-variant-caps: normal; letter-spacing: normal; orphans: 2; text-indent: 0px; text-transform: none; white-space: normal; widows: 2; word-spacing: 0px; -webkit-text-stroke-width: 0px; background-color: rgb(255, 255, 255); text-decoration-style: initial; text-decoration-color: initial;"">因此建议将源码包下载下来，并直接放在项目下的extra_apps中，如下所示：</p><p style=""box-sizing: border-box; outline: 0px; padding: 0px; margin: 0px 0px 16px; font-size: 16px; color: rgb(79, 79, 79); font-weight: normal; line-height: 26px; text-align: justify; word-break: break-all; font-family: -apple-system, &quot;SF UI Text&quot;, Arial, &quot;PingFang SC&quot;, &quot;Hiragino Sans GB&quot;, &quot;Microsoft YaHei&quot;, &quot;WenQuanYi Micro Hei&quot;, sans-serif, SimHei, SimSun; font-style: normal; font-variant-ligatures: normal; font-variant-caps: normal; letter-spacing: normal; orphans: 2; text-indent: 0px; text-transform: none; white-space: normal; widows: 2; word-spacing: 0px; -webkit-text-stroke-width: 0px; background-color: rgb(255, 255, 255); text-decoration-style: initial; text-decoration-color: initial;""><img src=""https://img-blog.csdn.net/20180120151950476?watermark/2/text/aHR0cDovL2Jsb2cuY3Nkbi5uZXQvZ2Vlcm5peWE=/font/5a6L5L2T/fontsize/400/fill/I0JBQkFCMA==/dissolve/70/gravity/SouthEast"" alt=""这里写图片描述"" title="""" style=""box-sizing: border-box; outline: 0px; margin: 24px 0px; max-width: 100%; word-break: break-all; cursor: zoom-in;""/></p><p><br/></p>",0,1,2018-05-22 11:37:24.907557,2,0,2018-05-22 11:37:24.905557
